id,standard,topic,subtopic,category,type,question,choices,answer,accepted_answers,match_mode,explanation,difficulty,active,part1_label,part1_type,part1_choices,part1_answer,part1_accepted_answers,part2_label,part2_type,part2_choices,part2_answer,part2_accepted_answers,part3_label,part3_type,part3_choices,part3_answer,part3_accepted_answers,part4_label,part4_type,part4_choices,part4_answer,part4_accepted_answers,part5_label,part5_type,part5_choices,part5_answer,part5_accepted_answers,part6_label,part6_type,part6_choices,part6_answer,part6_accepted_answers
79f6f32a-d6ff-ae64-f5ce-8503837e7483,IFRS 15,Revenue,Sale with a right of return,Measurement,mcq,"A product is payable 24 months after delivery, but revenue cannot be recognised until a 3-month return right lapses. When does interest begin to accrue on the receivable?",At the original delivery date|When the return right lapses and the receivable is recognised|When cash is collected|At the end of the reporting period,When the return right lapses and the receivable is recognised,,strict,"No receivable exists during the uncertain return period. **Interest begins only when the receivable is recognised**, after the return right lapses.",tricky,TRUE,,,,,,,,,,,,,,,,,,,,,,,,,,,,,,
522a1d6a-e2aa-b65e-0d7e-9994897b04d9,IFRS 15,Revenue,Sale with a right of return,Measurement,mcq,"A product has a cash selling price of 10,000 and deferred consideration of 12,100. Once revenue recognition becomes appropriate, what amount is initially recognised as revenue?","10,000|12,100|2,100|The full amount expected at collection date","10,000",,strict,"Revenue is initially measured at the **cash selling price of 10,000**. The additional 2,100 is a **financing return**, recognised separately over time.",applied,TRUE,,,,,,,,,,,,,,,,,,,,,,,,,,,,,,
e4dcb7dc-eb3c-0ead-a8b7-0d2246e12aa3,IFRS 15,Revenue,Warranties,Classification,dropdown,A customer can purchase an extended warranty separately from the product. The warranty is accounted for as ____.,an IAS 37 provision only|a separate performance obligation|a reduction of revenue|a contract acquisition cost,a separate performance obligation,,strict,A separately purchasable warranty represents a **distinct service** and is therefore a **separate performance obligation**.,core,TRUE,,,,,,,,,,,,,,,,,,,,,,,,,,,,,,
32fb41cd-c321-b569-6b27-143ef70f4851,IFRS 15,Revenue,Warranties,Classification,mcq,A warranty cannot be purchased separately and only assures that the product complies with agreed specifications. How should it be accounted for?,As a separate performance obligation under IFRS 15|As a provision under IAS 37|As variable consideration|As a contract asset,As a provision under IAS 37,,strict,"An assurance-only warranty that is not sold separately is accounted for under **IAS 37**, rather than as a separate performance obligation.",core,TRUE,,,,,,,,,,,,,,,,,,,,,,,,,,,,,,
600463f3-bc14-13ae-c71e-bec5c279145f,IFRS 15,Revenue,Warranties,Classification,mcq,A compulsory warranty both assures compliance with specifications and provides additional maintenance services. What is the key accounting consequence?,The entire warranty must always be an IAS 37 provision|The service element is a performance obligation|The warranty is ignored because it is compulsory|All product revenue is deferred until the warranty expires,The service element is a performance obligation,,strict,"Where a warranty provides an **additional service**, that service is a **performance obligation**, even if the warranty is not separately purchasable.",applied,TRUE,,,,,,,,,,,,,,,,,,,,,,,,,,,,,,
99a7eba2-be5f-41d1-8e53-d6a505677dde,IFRS 15,Revenue,Warranties,Classification,multi_part,"For each warranty feature, select the resulting accounting treatment.",,,,strict,The decision turns on whether the warranty is **sold separately** or provides a **service beyond assurance**.,applied,TRUE,Separately purchasable warranty,dropdown,Separate performance obligation|IAS 37 provision,Separate performance obligation,,Assurance-only warranty not separately purchasable,dropdown,Separate performance obligation|IAS 37 provision,IAS 37 provision,,Additional service beyond assurance,dropdown,Service element is a performance obligation|Entire warranty is only an IAS 37 provision,Service element is a performance obligation,,,,,,,,,,,,,,,,
130aaebe-9412-9472-196d-f1d454d7c0db,IFRS 15,Revenue,Principal versus agent,Presentation,dropdown,An entity controls the specified good before transfer to the customer. Revenue is normally recognised at the ____ amount of consideration.,net|gross|discounted commission|cost,gross,,strict,A principal controls the good or service before transfer and recognises the **gross consideration as revenue**.,core,TRUE,,,,,,,,,,,,,,,,,,,,,,,,,,,,,,
e24df26b-3fff-059b-5875-aad97f26b47f,IFRS 15,Revenue,Principal versus agent,Presentation,mcq,An entity merely arranges for another party to provide goods to the customer. What amount should it recognise as revenue?,The gross customer payment|Its fee or commission|The supplier's cost|The customer payment less inventory cost,Its fee or commission,,strict,An agent does not control the specified good before transfer and recognises only its **fee or commission** as revenue.,core,TRUE,,,,,,,,,,,,,,,,,,,,,,,,,,,,,,
8c568feb-1aaf-2168-87f6-6ecbee5e3736,IFRS 15,Revenue,Principal versus agent,Classification,multi_select,Which factors indicate that an entity may control the specified good or service before transfer and therefore act as principal?,Primary responsibility for fulfilling the promise|Inventory risk|Discretion in establishing price|Receiving cash before the supplier|Operating a website|Charging a percentage-based fee,Primary responsibility for fulfilling the promise|Inventory risk|Discretion in establishing price,,strict,"Key indicators of control include **primary fulfilment responsibility**, **inventory risk**, and **pricing discretion**.",core,TRUE,,,,,,,,,,,,,,,,,,,,,,,,,,,,,,
90b5f9f5-d453-4d07-75c6-6053793680d7,IFRS 15,Revenue,Principal versus agent,Application,mcq,A website connects customers with suppliers. Suppliers set prices and deliver directly. The website has no inventory risk or obligation if suppliers fail and earns 5% commission. How should it report revenue?,Gross customer receipts|The 5% commission only|Gross receipts less delivery costs|No revenue until the supplier is paid,The 5% commission only,,strict,"The website is an **agent** because it does not control the goods, bear inventory risk, set prices, or fulfil the customer promise. Revenue is the **5% commission**.",applied,TRUE,,,,,,,,,,,,,,,,,,,,,,,,,,,,,,
27d2d301-c7a2-f584-fcfd-9066615a8a4d,IFRS 15,Revenue,Principal versus agent,Recognition,text,What is the central question when deciding whether an entity is a principal or an agent?,,Whether the entity controls the specified good or service before it is transferred to the customer,Control before transfer|Whether the entity controls the good or service before transfer|Whether control is obtained before transfer,variants,The decisive issue is whether the entity **controls the specified good or service before transfer** to the customer.,core,TRUE,,,,,,,,,,,,,,,,,,,,,,,,,,,,,,
ee191c1e-1c79-c677-5e74-66b4261c5872,IFRS 15,Revenue,Non-refundable upfront fees,Recognition,mcq,A customer pays a non-refundable activation fee. The activation work is only an internal administrative task and transfers no good or service. When is the fee recognised as revenue?,Immediately when received|When the administrative work is completed|As the future goods or services are provided|Only when the contract is terminated,As the future goods or services are provided,,strict,"Because the activation activity transfers no service, the fee is an **advance payment for future goods or services** and is recognised as those services are provided.",applied,TRUE,,,,,,,,,,,,,,,,,,,,,,,,,,,,,,
f72b6c5e-544c-a0ea-b0a3-499040889c9f,IFRS 15,Revenue,Non-refundable upfront fees,Recognition,multi_part,Complete the decision process for a non-refundable upfront fee.,,,,variants,"First ask whether the fee relates to a **promised good or service transferred to the customer**. If not, it is an **advance payment** for future performance.",core,TRUE,Fee relates to a transferred good or service,text,,Assess whether that good or service is a separate performance obligation,Determine whether it is a separate performance obligation|Assess if it is distinct,Fee does not relate to a transferred good or service,text,,Treat it as an advance payment and recognise revenue when future goods or services are provided,Advance payment for future services|Recognise over future goods or services,,,,,,,,,,,,,,,,,,,,
3f783f1f-8833-56e6-8700-b466df2e4ec3,IFRS 15,Revenue,Non-refundable upfront fees,Classification,dropdown,An internal account setup activity that does not transfer a benefit to the customer is ____ a performance obligation.,always|not|automatically a separate|partly,not,,strict,An **administrative task does not transfer a good or service** to the customer and is therefore **not a performance obligation**.,core,TRUE,,,,,,,,,,,,,,,,,,,,,,,,,,,,,,
efa7c22d-5517-a26a-cc9a-d6470d7ad573,IFRS 15,Revenue,Consignment arrangements,Recognition,mcq,Goods are delivered to a dealer on consignment. The dealer does not control them and may return unsold goods. What should the original seller do on delivery to the dealer?,Recognise revenue and derecognise inventory|Retain inventory and recognise no revenue|Recognise commission income|Recognise a receivable for the selling price,Retain inventory and recognise no revenue,,strict,Delivery to the consignee does not transfer control. The seller **retains the goods in inventory** and **does not recognise revenue** until control passes to the final customer.,applied,TRUE,,,,,,,,,,,,,,,,,,,,,,,,,,,,,,
b2f60ccf-bc29-1e91-19a7-2fab5cb98f91,IFRS 15,Revenue,Consignment arrangements,Recognition,text,"In a consignment arrangement, when does the original seller normally recognise revenue?",,When control of the product passes to the final customer,On sale to the end customer|When the final customer obtains control|When control passes to the end customer,variants,"Revenue is recognised only when **control passes to the final customer**, not merely when goods are delivered to the intermediary.",core,TRUE,,,,,,,,,,,,,,,,,,,,,,,,,,,,,,
2ad7b03d-e634-f7f1-8b30-9bb1c302e491,IFRS 15,Revenue,Repurchase agreements,Classification,multi_part,An entity sells an asset but is obliged to repurchase it later. Select the treatment for each repurchase price.,,,,strict,"Under a forward, the customer does not obtain control. A repurchase price below the original selling price generally produces a **lease**; a price equal to or above it produces a **financing arrangement**.",applied,TRUE,Repurchase price below original selling price,dropdown,Lease|Financing arrangement|Outright sale,Lease,,Repurchase price equal to or above original selling price,dropdown,Lease|Financing arrangement|Outright sale,Financing arrangement,,,,,,,,,,,,,,,,,,,,,
49c8020a-55dd-289c-81da-294cdfd2279f,IFRS 15,Revenue,Repurchase agreements,Recognition,mcq,An entity has a call option allowing it to repurchase an asset it has sold. Does the customer obtain control of the asset at the original sale date?,Yes because physical possession transferred|Yes unless the option is exercised|No because the seller retains the right to repurchase|Only if the customer pays cash immediately,No because the seller retains the right to repurchase,,strict,"With a seller-held **call option**, the customer does not obtain control because the seller retains the right to reclaim the asset.",core,TRUE,,,,,,,,,,,,,,,,,,,,,,,,,,,,,,
0a6035b9-d087-0b6b-1e28-3af1125c9b1d,IFRS 15,Revenue,Repurchase agreements,Classification,mcq,A customer has a put option. The repurchase price is below the original selling price and the customer has no significant economic incentive to exercise it. How is the arrangement accounted for?,Lease|Financing arrangement|Outright sale with a right of return|Consignment arrangement,Outright sale with a right of return,,strict,"Where the put price is below the original price and exercise is not economically attractive, account for an **outright sale with a right of return**.",applied,TRUE,,,,,,,,,,,,,,,,,,,,,,,,,,,,,,
2c45c8a2-1236-05e2-0b92-7852eaf86510,IFRS 15,Revenue,Repurchase agreements,Classification,mcq,"A customer has a put option. The repurchase price is below the original selling price, but the customer has a significant economic incentive to exercise it. What is the treatment?",Outright sale|Lease|Financing arrangement|Contract liability only,Lease,,strict,A significant economic incentive to exercise the put means the customer has not obtained substantive control. The arrangement is accounted for as a **lease**.,applied,TRUE,,,,,,,,,,,,,,,,,,,,,,,,,,,,,,
9c4c947d-b446-bc28-0fe4-eb2dd2db6ff7,IFRS 15,Revenue,Repurchase agreements,Classification,dropdown,A put option is accounted for as a financing arrangement when the repurchase price is at least the original selling price and is ____ the expected market value at the repurchase date.,below|equal to or below|above|unrelated to,above,,strict,A put arrangement is a **financing arrangement** where the repurchase price is at least the original selling price and **above the expected market value**.,tricky,TRUE,,,,,,,,,,,,,,,,,,,,,,,,,,,,,,
bbf00bc4-c599-20a9-e0c6-93cc0a17b72f,IFRS 15,Revenue,Repurchase agreements,Classification,multi_part,Classify each repurchase arrangement.,,,,strict,Forwards and call options prevent transfer of control. Put options require assessment of **repurchase price** and the customer's **economic incentive to exercise**.,tricky,TRUE,Seller must repurchase below original price,dropdown,Lease|Financing arrangement|Sale with right of return,Lease,,Seller may repurchase at or above original price,dropdown,Lease|Financing arrangement|Sale with right of return,Financing arrangement,,Customer may require repurchase below original price and lacks economic incentive,dropdown,Lease|Financing arrangement|Sale with right of return,Sale with right of return,,Customer may require repurchase below original price and has economic incentive,dropdown,Lease|Financing arrangement|Sale with right of return,Lease,,Customer may require repurchase above original price and above expected market value,dropdown,Lease|Financing arrangement|Sale with right of return,Financing arrangement,,,,,,
20bf62d3-485d-d4f0-c83a-e2e8ca8c7c62,IFRS 15,Revenue,Change in transaction price,Measurement,mcq,A transaction price changes after contract inception. On what basis is the change normally allocated to performance obligations?,Current stand-alone selling prices|Original allocation percentages based on stand-alone selling prices at contract inception|Relative costs incurred to date|Management's latest revenue forecast,Original allocation percentages based on stand-alone selling prices at contract inception,,strict,"A change in transaction price is normally allocated using the **same basis as the original allocation**, using stand-alone selling prices at **contract inception**.",core,TRUE,,,,,,,,,,,,,,,,,,,,,,,,,,,,,,
b2530676-c54f-8529-2208-1e80b12d31b3,IFRS 15,Revenue,Change in transaction price,Measurement,mcq,When may a change in transaction price be allocated entirely to one specific performance obligation?,Whenever that obligation has the highest stand-alone selling price|When the change relates specifically to that obligation and the allocation objective is met|Only when the obligation is already satisfied|Whenever management considers it convenient,When the change relates specifically to that obligation and the allocation objective is met,,strict,A change may be allocated to a specific obligation when it **relates specifically to that obligation** and doing so meets IFRS 15's **allocation objective**.,applied,TRUE,,,,,,,,,,,,,,,,,,,,,,,,,,,,,,
7ebf6a86-7de0-7a0f-72c2-1e6d75b3064c,IFRS 15,Revenue,Change in transaction price,Recognition,dropdown,A change in transaction price allocated to a performance obligation already satisfied is recognised ____ in the period of the change.,as an adjustment to revenue|as a contract asset only|in other comprehensive income|only when cash is received,as an adjustment to revenue,,strict,A change allocated to a satisfied obligation is recognised immediately as **revenue or a reduction of revenue** in the period of change.,core,TRUE,,,,,,,,,,,,,,,,,,,,,,,,,,,,,,
70f6f44a-02e0-ff8a-ebbc-02c9c68f2e4c,IFRS 15,Revenue,Change in transaction price,Recognition,mcq,How is a price change allocated to an unsatisfied performance obligation recognised?,Immediately in full|As the performance obligation is subsequently satisfied|Only on contract completion|As finance income,As the performance obligation is subsequently satisfied,,strict,"A change allocated to an unsatisfied obligation is recognised on the **same basis as the original amount**, as that obligation is satisfied.",core,TRUE,,,,,,,,,,,,,,,,,,,,,,,,,,,,,,
f0759dfd-6622-c46c-6b80-1a030a230eb7,IFRS 15,Revenue,Change in transaction price,Recognition,multi_part,A 100 increase in transaction price is allocated 40 to an obligation already satisfied and 60 to an obligation not yet satisfied. State the treatment.,,,,variants,"The amount relating to the completed obligation is recognised **immediately**, while the remainder is recognised when the **unsatisfied obligation is performed**.",applied,TRUE,Satisfied obligation,text,,Recognise 40 as revenue immediately,Revenue 40 immediately|Immediate revenue of 40,Unsatisfied obligation,text,,Recognise 60 as the obligation is satisfied,Recognise 60 later|Revenue 60 when performance occurs,,,,,,,,,,,,,,,,,,,,
db0065ed-6c59-7b48-d716-65a8943ab132,IFRS 15,Revenue,Contract modifications,Classification,multi_select,Which changes may constitute a contract modification under IFRS 15?,A change in contract scope|A change in contract price|A change creating new enforceable rights and obligations|A change in the entity's internal budget|A change in estimated production cost only,A change in contract scope|A change in contract price|A change creating new enforceable rights and obligations,,strict,"A contract modification is an approved change in **scope**, **price**, or both that creates or changes **enforceable rights and obligations**.",core,TRUE,,,,,,,,,,,,,,,,,,,,,,,,,,,,,,
a9339359-efa1-ac7d-1788-132308399b34,IFRS 15,Revenue,Contract modifications,Recognition,mcq,"The parties are discussing a contract modification, but it has not yet been approved. What should the entity do?",Account for the expected modification immediately|Continue applying IFRS 15 to the original contract until approval|Terminate the original contract|Recognise a provision for the expected price change,Continue applying IFRS 15 to the original contract until approval,,strict,"Until both parties approve the modification, the entity continues to account for the **original contract**.",core,TRUE,,,,,,,,,,,,,,,,,,,,,,,,,,,,,,
54044023-09ff-b60b-762c-e9d7b40dc78f,IFRS 15,Revenue,Contract modifications,Classification,multi_part,State the two conditions required for a contract modification to be accounted for as a separate contract.,,,,variants,A separate contract requires both **distinct additional goods or services** and a price increase reflecting their **stand-alone selling prices**.,core,TRUE,Scope condition,text,,The contract scope increases through additional distinct goods or services,Additional distinct goods or services|Scope increases with distinct goods or services,Price condition,text,,The contract price increases by an amount reflecting the stand-alone selling prices of the additional goods or services,Price reflects stand-alone selling price|Increase at standalone selling prices,,,,,,,,,,,,,,,,,,,,
93a3439f-57be-d536-82ad-6e9769d7b1b7,IFRS 15,Revenue,Contract modifications,Classification,mcq,A customer adds 100 distinct units to an existing contract at their current stand-alone selling price. How is the modification normally accounted for?,As a separate contract|As termination and replacement|As a cumulative catch-up adjustment|As a financing arrangement,As a separate contract,,strict,"The additional goods are **distinct** and priced at their **stand-alone selling price**, so the modification is a separate contract.",applied,TRUE,,,,,,,,,,,,,,,,,,,,,,,,,,,,,,
9895bd16-b5ce-4ad2-21a3-bad6fbc243c2,IFRS 15,Revenue,Contract modifications,Classification,dropdown,A modification is not a separate contract. The remaining goods are distinct from those already transferred. The original contract is treated as ____ and replaced by a new contract.,continued unchanged|terminated|fully satisfied|impaired,terminated,,strict,"Where remaining goods are distinct, the original contract is treated as **terminated** and replaced by a **new contract** for the remaining goods.",core,TRUE,,,,,,,,,,,,,,,,,,,,,,,,,,,,,,
40b86976-6dea-baa6-a578-6dcfba07635b,IFRS 15,Revenue,Contract modifications,Measurement,multi_select,What is included in the transaction price of a replacement contract when the remaining goods are distinct?,Consideration from the original contract not yet recognised as revenue|Consideration promised in the modification|Revenue already recognised before modification|The carrying amount of inventory|Historic contract acquisition costs,Consideration from the original contract not yet recognised as revenue|Consideration promised in the modification,,strict,The replacement contract includes **unrecognised consideration from the original contract** plus **consideration promised in the modification**.,core,TRUE,,,,,,,,,,,,,,,,,,,,,,,,,,,,,,
253caff5-dbe2-1116-c090-576d491ce2cf,IFRS 15,Revenue,Contract modifications,Classification,mcq,A modification is not a separate contract and the remaining work is not distinct from work already performed. How is the modification accounted for?,As termination and replacement|As a continuation of the original contract with a cumulative catch-up adjustment|As a separate contract|As an executory contract with no accounting effect,As a continuation of the original contract with a cumulative catch-up adjustment,,strict,"Where the remaining work forms part of a single partially satisfied performance obligation, the modification is a **continuation** with a **cumulative catch-up adjustment**.",core,TRUE,,,,,,,,,,,,,,,,,,,,,,,,,,,,,,
6874df8d-3dc5-918a-5295-cbb4ceb28445,IFRS 15,Revenue,Contract modifications,Classification,text,What treatment may be required when a contract modification affects some remaining goods that are distinct and others that are not distinct?,,A combination of termination and replacement treatment and continuation treatment,Combination treatment|A combination of replacement and continuation|Part replacement and part continuation,variants,IFRS 15 may require a **combination** of the replacement-contract and continuation approaches.,tricky,TRUE,,,,,,,,,,,,,,,,,,,,,,,,,,,,,,
81a3f980-c4a5-2a25-5ee5-8d636427e212,IFRS 15,Revenue,Contract modifications,Application,mcq,Rivington provides substantially identical weekly cleaning services over three years using the same transfer pattern. How many performance obligations does the original contract contain?,One|Three|156|A separate obligation for each invoice,One,,strict,"The weekly services form a **series of distinct services** that are substantially the same and have the same transfer pattern, so they are one performance obligation.",applied,TRUE,,,,,,,,,,,,,,,,,,,,,,,,,,,,,,
6c8d6b78-4f4d-dcf4-5620-061456a93584,IFRS 15,Revenue,Contract modifications,Application,mcq,"Rivington extends a cleaning contract by two years. The added services are distinct, but the total added price does not reflect their stand-alone selling prices. How is the modification treated?",As a separate contract|As termination of the original contract and creation of a new contract|As continuation of the original contract|As variable consideration only,As termination of the original contract and creation of a new contract,,strict,"The future services are **distinct**, but the price condition for a separate contract is not met. The original contract is therefore **terminated and replaced**.",applied,TRUE,,,,,,,,,,,,,,,,,,,,,,,,,,,,,,
4c51211b-4cf9-39ad-b986-99933b20c620,IFRS 15,Revenue,Contract modifications,Measurement,calculation,"After modification, Rivington has 140,000 of consideration allocated to three remaining years of cleaning services. What annual revenue should be recognised?",,46667,"46,667|46666.67|46,666.67",variants,"The replacement contract revenue is **140,000 divided by three years**, giving approximately **46,667 per year**.",applied,TRUE,,,,,,,,,,,,,,,,,,,,,,,,,,,,,,
82d79b3c-4e5c-980d-a31f-8e6417f999cf,IFRS 15,Revenue,Contract modifications,Application,mcq,A stadium construction contract is modified to increase the stadium's size. The additional work enhances the same partially completed asset and is not distinct. What treatment applies?,Separate contract|Termination and replacement|Continuation of the original contract|No accounting until completion,Continuation of the original contract,,strict,"The added work is not distinct from the work already performed and remains part of the **same performance obligation**, so the modification is a continuation.",applied,TRUE,,,,,,,,,,,,,,,,,,,,,,,,,,,,,,
