id,standard,topic,subtopic,category,type,question,choices,answer,accepted_answers,match_mode,explanation,difficulty,active,part1_label,part1_type,part1_choices,part1_answer,part1_accepted_answers,part2_label,part2_type,part2_choices,part2_answer,part2_accepted_answers,part3_label,part3_type,part3_choices,part3_answer,part3_accepted_answers,part4_label,part4_type,part4_choices,part4_answer,part4_accepted_answers,part5_label,part5_type,part5_choices,part5_answer,part5_accepted_answers,part6_label,part6_type,part6_choices,part6_answer,part6_accepted_answers
92cc4c23-7cc6-4620-a402-fa03dd756414,IFRS 15,Revenue,Identifying a contract with a customer,Recognition,multi_select,The contract-identification criteria are not met. Which conditions must all be present for consideration already received to be recognised as revenue under the no-remaining-obligations exception?,The entity has no remaining obligations to the customer|Substantially all of the consideration has been received|The consideration received is non-refundable|The customer has legal title|Collection of the remaining consideration is probable,The entity has no remaining obligations to the customer|Substantially all of the consideration has been received|The consideration received is non-refundable,,strict,"Revenue is recognised only when there are **no remaining obligations**, **substantially all consideration has been received**, and that consideration is **non-refundable**. All three conditions are required.",applied,TRUE,,,,,,,,,,,,,,,,,,,,,,,,,,,,,,
b5477675-cf02-668a-bceb-0c9cee0b4c72,IFRS 15,Revenue,Identifying a contract with a customer,Recognition,mcq,The IFRS 15 contract-identification criteria were never met. The seller has now terminated the contract and may retain the customer's non-refundable payment. How is the payment recognised?,Revenue|Contract liability|Trade receivable|Refund liability,Revenue,,strict,"When the contract has been **terminated** and the consideration received is **non-refundable**, IFRS 15 permits the amount to be recognised as **revenue**.",applied,TRUE,,,,,,,,,,,,,,,,,,,,,,,,,,,,,,
759504d8-b51d-b812-a68d-c140b8795759,IFRS 15,Revenue,Identifying a contract with a customer,Recognition,mcq,An arrangement does not initially meet all five contract-identification criteria. What must the entity do next?,Permanently exclude the arrangement from IFRS 15|Continue to assess whether the criteria are subsequently met|Recognise all cash received as revenue immediately|Apply the revenue model using the most likely payment terms,Continue to assess whether the criteria are subsequently met,,strict,"The entity must **continue to assess the arrangement**. If all criteria are met later, it applies the IFRS 15 revenue recognition model from that point.",core,TRUE,,,,,,,,,,,,,,,,,,,,,,,,,,,,,,
8c764f1f-abc2-695a-6dc9-2b6dfb09473d,IFRS 15,Revenue,Revenue recognition model,Standard,standard_match,Which standard is titled Revenue from Contracts with Customers?,IAS 18|IFRS 9|IFRS 15|IFRS 18,IFRS 15,,strict,The applicable standard is **IFRS 15 Revenue from Contracts with Customers**.,core,TRUE,,,,,,,,,,,,,,,,,,,,,,,,,,,,,,
5e8e55e5-80bd-230d-cf6f-b6d507a4d7c8,IFRS 15,Revenue,Identifying performance obligations,Definition,multi_select,Which promises can qualify as a performance obligation under IFRS 15?,A distinct good or service|A distinct bundle of goods or services|A series of substantially similar distinct goods or services with the same pattern of transfer|Every administrative activity performed by the entity|Every item listed separately on an invoice,A distinct good or service|A distinct bundle of goods or services|A series of substantially similar distinct goods or services with the same pattern of transfer,,strict,"A performance obligation is a promise to transfer a **distinct good or service**, a **distinct bundle**, or a qualifying **series of distinct goods or services**.",core,TRUE,,,,,,,,,,,,,,,,,,,,,,,,,,,,,,
b4a05ee1-f098-dc48-88e0-066c13f6edc8,IFRS 15,Revenue,Identifying performance obligations,Recognition,multi_part,State the two conditions that must be met for a promised good or service to be distinct.,,,,variants,A promised good or service is distinct only when the customer can **benefit from it** and the promise is **separately identifiable** from other promises in the contract.,core,TRUE,Capable of being distinct,text,,The customer can benefit from the good or service on its own or together with other readily available resources,Customer can benefit on its own|Customer can benefit with readily available resources|Capable of being distinct,Distinct within the contract,text,,The promise to transfer the good or service is separately identifiable from other promises in the contract,Separately identifiable|Distinct within the context of the contract,,,,,,,,,,,,,,,,,,,,
eaa0b932-dda5-7dee-d8d1-017ea05c5b74,IFRS 15,Revenue,Identifying performance obligations,Classification,dropdown,A promised service is not distinct from the other promises in a contract. The entity should ____ until it identifies a distinct bundle.,ignore the service|recognise revenue immediately|combine it with other promised goods or services|account for it as a contract cost,combine it with other promised goods or services,,strict,A non-distinct promise is **combined with other promised goods or services** until a distinct bundle is identified.,core,TRUE,,,,,,,,,,,,,,,,,,,,,,,,,,,,,,
b17e19b8-1c09-101b-0fc5-aa6f3fc7beba,IFRS 15,Revenue,Identifying performance obligations,Recognition,mcq,When may a series of services be treated as one performance obligation?,When the services are substantially the same and have the same pattern of transfer|Whenever the services are invoiced monthly|Whenever the contract lasts more than one year|Only when each service is individually immaterial,When the services are substantially the same and have the same pattern of transfer,,strict,A qualifying series consists of **distinct goods or services that are substantially the same** and have the **same pattern of transfer**.,core,TRUE,,,,,,,,,,,,,,,,,,,,,,,,,,,,,,
2d43b256-b020-740c-68d0-0400f6cc2f59,IFRS 15,Revenue,Identifying performance obligations,Application,calculation,"CommSoft is supplied with a software licence, installation, three years of technical support and three years of updates. Each item is distinct. How many performance obligations are identified?",,4,four,variants,"The contract contains **four performance obligations**: the licence, installation, technical support and updates.",applied,TRUE,,,,,,,,,,,,,,,,,,,,,,,,,,,,,,
f5517192-1f61-d8c8-c2df-53e5ca67109c,IFRS 15,Revenue,Identifying performance obligations,Application,mcq,Why is the CommSoft installation service treated as distinct from the software licence?,The installation significantly customises the software|Only the software supplier can perform the installation|The installation does not significantly modify the software and can be provided by others|Installation is always a separate performance obligation,The installation does not significantly modify the software and can be provided by others,,strict,The installation is distinct because it **does not significantly modify the software** and the customer can obtain installation from **other providers**.,applied,TRUE,,,,,,,,,,,,,,,,,,,,,,,,,,,,,,
24fc58d5-b913-4feb-706a-9697b93e52f0,IFRS 15,Revenue,Determining the transaction price,Measurement,text,What is the transaction price under IFRS 15?,,The amount of consideration to which the entity expects to be entitled in exchange for transferring promised goods or services to the customer,Amount of consideration expected in exchange for promised goods or services|Consideration to which the entity expects to be entitled,variants,"The transaction price is the **consideration the entity expects to be entitled to** for transferring promised goods or services, excluding amounts collected for third parties.",core,TRUE,,,,,,,,,,,,,,,,,,,,,,,,,,,,,,
cb20be1b-cdb5-020a-4e4f-23fbbe85ee9f,IFRS 15,Revenue,Determining the transaction price,Measurement,multi_select,Which matters must be considered when determining the transaction price?,Significant financing component|Non-cash consideration|Consideration payable to a customer|Variable consideration|Customer's depreciation policy|Seller's inventory valuation method,Significant financing component|Non-cash consideration|Consideration payable to a customer|Variable consideration,,strict,"The transaction price considers **financing**, **non-cash consideration**, **payments to customers**, and **variable consideration**.",core,TRUE,,,,,,,,,,,,,,,,,,,,,,,,,,,,,,
e108c6e1-ecd7-cf5f-325e-1162662cbade,IFRS 15,Revenue,Variable consideration,Measurement,dropdown,Variable consideration is included in the transaction price only when it is highly probable that a significant ____ of cumulative revenue will not occur.,increase|reversal|reclassification|impairment,reversal,,strict,The variable amount is constrained unless it is **highly probable that a significant reversal of cumulative revenue will not occur**.,core,TRUE,,,,,,,,,,,,,,,,,,,,,,,,,,,,,,
fcbceb39-1ab5-5b95-581f-da920b20fe70,IFRS 15,Revenue,Variable consideration,Measurement,multi_part,Select the appropriate method for measuring variable consideration in each situation.,,,,strict,"Use the **expected value** for a range of possible outcomes or many similar contracts, and the **most likely amount** where there are only two possible outcomes.",applied,TRUE,Many similar contracts,dropdown,Probability-weighted expected value|Most likely amount,Probability-weighted expected value,,Only two possible outcomes,dropdown,Probability-weighted expected value|Most likely amount,Most likely amount,,,,,,,,,,,,,,,,,,,,,
590eebb8-276a-96fe-b09b-b8839b2e9b98,IFRS 15,Revenue,Significant financing component,Measurement,mcq,When may an entity apply the practical expedient and avoid adjusting promised consideration for a significant financing component?,When payment is expected within one year of transfer|Whenever the customer pays in advance|Whenever the contract is non-refundable|When the financing rate is below 10%,When payment is expected within one year of transfer,,strict,Discounting is generally not required where the period between transfer and payment is **one year or less**.,core,TRUE,,,,,,,,,,,,,,,,,,,,,,,,,,,,,,
4efcf110-4d4b-a9ab-87e5-7ce304c21ed4,IFRS 15,Revenue,Significant financing component,Presentation,multi_part,"Goods are transferred today for payment of 2,000 in two years. The present value is 1,814. Complete the initial accounting treatment.",,,,variants,"Revenue and the receivable are initially recognised at the **present value of 1,814**. The remaining amount is recognised over time as **finance income**, not revenue.",applied,TRUE,Debit,text,,"Trade receivables 1,814",Trade receivable 1814|Receivable 1814|Trade receivables 1814,Credit,text,,"Revenue 1,814",Revenue 1814,,,,,,,,,,,,,,,,,,,,
b550d310-826b-af17-1bdb-ac6515c46e2c,IFRS 15,Revenue,Significant financing component,Measurement,calculation,"A customer will pay 2,000 in two years and the relevant annual rate is 5%. State the calculation used to determine the initial transaction price.",,2000 / 1.05^2,2000/1.05^2|2000 × 1/1.05^2|2000*1/1.05^2,variants,"The promised payment is discounted to present value using **2,000 divided by 1.05 squared**. The initial revenue is approximately **1,814**.",applied,TRUE,,,,,,,,,,,,,,,,,,,,,,,,,,,,,,
29660854-b8aa-4915-0265-5e8dc1bec43a,IFRS 15,Revenue,Consideration payable to a customer,Measurement,multi_part,An entity pays a customer 3 million to alter its shelves. The payment does not purchase a distinct good or service. How is it accounted for?,,,,variants,The payment is initially recognised as a **contract asset** and subsequently reduces the **transaction price and revenue** as related goods are transferred.,applied,TRUE,At payment date,text,,Recognise a contract asset and credit cash,Debit contract asset and credit cash|Contract asset,As goods are transferred,text,,Reduce the transaction price and revenue,Reduce revenue|Reduction of transaction price|Credit contract asset as revenue is recognised,,,,,,,,,,,,,,,,,,,,
00346017-2e2a-9e73-f826-c0a33f0e3974,IFRS 15,Revenue,Variable consideration,Measurement,multi_part,"A product normally sells for 200 per unit but the price falls retrospectively to 180 if annual purchases exceed 1,000 units. At year end the threshold is highly probable. Calculate the revenue for 500 current-quarter units and the reduction required for 75 earlier units.",,,,strict,"Once the threshold becomes highly probable, current sales use **180 per unit** and prior revenue is reduced for the **20 per unit retrospective discount**.",applied,TRUE,Current-quarter revenue,text,,90000,"90,000|$90,000",Prior-quarter revenue reduction,text,,1500,"1,500|$1,500",,,,,,,,,,,,,,,,,,,,
637237fa-552d-7cd3-e9d7-1aa714115cad,IFRS 15,Revenue,Allocating the transaction price,Measurement,text,How is the transaction price allocated between separate performance obligations?,,In proportion to their relative stand-alone selling prices at contract inception,Relative stand-alone selling prices|Proportionately based on stand-alone selling prices at contract inception|Based on relative standalone selling prices,variants,The transaction price is allocated using the **relative stand-alone selling prices at contract inception**.,core,TRUE,,,,,,,,,,,,,,,,,,,,,,,,,,,,,,
65304dd1-9495-91cf-2e78-d56515b8a9b3,IFRS 15,Revenue,Allocating the transaction price,Measurement,multi_part,"A car and two years of servicing are sold together for 21,000. Their stand-alone selling prices are 20,520 and 1,080. State the allocated revenue amounts.",,,,variants,"The total stand-alone selling price is 21,600. The relative proportions are **95% for the car** and **5% for servicing**, giving allocated revenue of **19,950** and **1,050**.",applied,TRUE,Car,text,,19950,"19,950|$19,950",Servicing,text,,1050,"1,050|$1,050",,,,,,,,,,,,,,,,,,,,
dd78303a-bb78-0a44-2053-5e8d7d788560,IFRS 15,Revenue,Satisfaction of performance obligations,Recognition,self_mark,Recall the IFRS 15 meaning of control of an asset.,,The ability to direct the use of and obtain substantially all of the remaining benefits from the asset,,self_mark,Control is the **ability to direct the use of** the asset and **obtain substantially all of its remaining benefits**.,core,TRUE,,,,,,,,,,,,,,,,,,,,,,,,,,,,,,
02932d38-046d-85ea-a070-9988206a8a22,IFRS 15,Revenue,Performance obligations satisfied over time,Recognition,self_mark,Recall the three alternative criteria under which a performance obligation is satisfied over time.,,The customer simultaneously receives and consumes the benefits as the entity performs; the entity creates or enhances an asset controlled by the customer; or the asset has no alternative use to the entity and the entity has an enforceable right to payment for performance completed to date,,self_mark,"Only one criterion is required: **simultaneous receipt and consumption**, **creation or enhancement of a customer-controlled asset**, or **no alternative use plus an enforceable right to payment**.",core,TRUE,,,,,,,,,,,,,,,,,,,,,,,,,,,,,,
43340d96-29a8-12a8-4aa1-1827f838df14,IFRS 15,Revenue,Performance obligations satisfied at a point in time,Recognition,multi_select,Which are indicators that control has transferred at a point in time?,The entity has a present right to payment|The customer has legal title|Physical possession has transferred|The customer has significant risks and rewards of ownership|The customer has accepted the asset|The seller has prepared an internal invoice|The seller expects to earn a profit,The entity has a present right to payment|The customer has legal title|Physical possession has transferred|The customer has significant risks and rewards of ownership|The customer has accepted the asset,,strict,"Indicators include **right to payment**, **legal title**, **physical possession**, **risks and rewards**, and **customer acceptance**.",core,TRUE,,,,,,,,,,,,,,,,,,,,,,,,,,,,,,
93d1312b-22fd-a1e2-609e-ec83b8c6afee,IFRS 15,Revenue,Timing of revenue recognition,Application,mcq,Gerrard is constructing a specialised asset. It may retain a deposit if the customer defaults but has no right to payment for the remaining work until delivery. When is revenue recognised?,Over time as construction progresses|When costs are incurred|At a point in time when the asset is delivered|Immediately when the deposit is received,At a point in time when the asset is delivered,,strict,Gerrard lacks an **enforceable right to payment for performance completed to date**. The single performance obligation is therefore satisfied **at delivery**.,tricky,TRUE,,,,,,,,,,,,,,,,,,,,,,,,,,,,,,
8cdbe97c-9d69-bb88-2fa3-0441d9e9a888,IFRS 15,Revenue,Costs of obtaining a contract,Recognition,mcq,How should incremental costs of obtaining a contract be accounted for when the entity expects to recover them?,Recognise an asset|Expense immediately in all cases|Recognise revenue|Recognise a contract liability,Recognise an asset,,strict,Incremental costs of obtaining a contract are recognised as **an asset** when the entity **expects to recover them**.,core,TRUE,,,,,,,,,,,,,,,,,,,,,,,,,,,,,,
cd356dbf-28d0-a756-b979-1e7345afd61d,IFRS 15,Revenue,Costs of obtaining a contract,Classification,dropdown,An incremental cost of obtaining a contract is a cost that the entity would ____ if the contract had not been obtained.,still incur|not have incurred|capitalise under IAS 16|charge to the customer,not have incurred,,strict,"An incremental cost is one the entity **would not have incurred if the contract had not been obtained**, such as a success-based sales commission.",core,TRUE,,,,,,,,,,,,,,,,,,,,,,,,,,,,,,
fcfa85ac-83db-445f-cdf8-df33adf65823,IFRS 15,Revenue,Costs to fulfil a contract,Recognition,multi_select,Which conditions must all be met before costs to fulfil a contract are recognised as an asset under IFRS 15?,The costs relate directly to an identifiable contract or anticipated contract|The costs generate or enhance resources used to satisfy future performance obligations|The costs are expected to be recovered|The costs have already been invoiced to the customer|The costs relate to general administration,The costs relate directly to an identifiable contract or anticipated contract|The costs generate or enhance resources used to satisfy future performance obligations|The costs are expected to be recovered,,strict,"Capitalisation requires all three conditions: **direct relationship to a contract**, **creation or enhancement of resources for future performance**, and **expected recovery**.",core,TRUE,,,,,,,,,,,,,,,,,,,,,,,,,,,,,,
3c7a7828-a67b-5ca3-bbaa-182922694f24,IFRS 15,Revenue,Costs to fulfil a contract,Classification,mcq,Costs incurred to fulfil a contract fall within the scope of IAS 2. Which standard should be applied to those costs?,IFRS 15|IAS 2|IAS 37|IFRS 9,IAS 2,,strict,The IFRS 15 fulfilment-cost rules apply only where the costs are **not within the scope of another standard**. Costs within IAS 2 are accounted for under **IAS 2**.,applied,TRUE,,,,,,,,,,,,,,,,,,,,,,,,,,,,,,
b37f7965-9deb-0ca0-8c3b-87cea178a0df,IFRS 15,Revenue,Amortisation of contract cost assets,Measurement,text,On what basis is an asset arising from contract costs amortised?,,On a systematic basis consistent with the pattern of transfer of the related goods or services,Systematically in line with transfer of the related goods or services|Consistent with the pattern of transfer of the goods or services|Systematic basis matching the transfer pattern,variants,The asset is amortised to profit or loss on a **systematic basis consistent with the transfer pattern** of the related goods or services.,core,TRUE,,,,,,,,,,,,,,,,,,,,,,,,,,,,,,
2eae4d89-4f86-5c96-8799-e67121d1c1e3,IFRS 15,Revenue,Costs of obtaining a contract,Measurement,mcq,When may incremental costs of obtaining a contract be expensed immediately as a practical expedient?,When the expected amortisation period is one year or less|When the contract value is immaterial|When payment is due within one year|When the customer may cancel the contract,When the expected amortisation period is one year or less,,strict,The practical expedient permits immediate expense recognition when the asset would otherwise have an **amortisation period of one year or less**.,core,TRUE,,,,,,,,,,,,,,,,,,,,,,,,,,,,,,
faea571a-5cad-e1dc-1a4d-8142f45cc7c1,IFRS 15,Revenue,Impairment of contract cost assets,Measurement,multi_part,Complete the IFRS 15 impairment test for a contract cost asset.,,,,variants,An impairment loss is recognised when carrying amount exceeds **remaining expected consideration less unrecognised direct costs**.,tricky,TRUE,Amount A,text,,The remaining consideration the entity expects to receive for the related goods or services,Remaining expected consideration|Expected remaining consideration,Less,text,,The direct costs of providing those goods or services that have not yet been recognised as expenses,Unrecognised direct costs|Remaining direct costs not yet expensed,Compare with,dropdown,Carrying amount of the contract cost asset|Original contract price|Cash received to date,Carrying amount of the contract cost asset,,,,,,,,,,,,,,,,
4e92770d-2093-8b01-4ac3-fc9970f6613d,IFRS 15,Revenue,Presentation of contract balances,Presentation,multi_part,Classify each balance under IFRS 15.,,,,strict,A **contract asset** is conditional on something other than time; a **receivable** is unconditional; a **contract liability** arises when consideration is received or due before transfer.,core,TRUE,Goods transferred before payment right becomes unconditional,dropdown,Contract asset|Receivable|Contract liability,Contract asset,,Only passage of time is required before payment is due,dropdown,Contract asset|Receivable|Contract liability,Receivable,,Customer pays before goods or services are transferred,dropdown,Contract asset|Receivable|Contract liability,Contract liability,,,,,,,,,,,,,,,,
4570e826-0ee4-245e-6b99-de1fbcd0fe23,IFRS 15,Revenue,Sale with a right of return,Recognition,multi_select,"When products are transferred with a right of return and some returns are expected, which balances should normally be recognised?",Revenue for consideration expected to be retained|Revenue for all invoiced consideration|A refund liability|An asset for the right to recover returned products|A provision for the full sales price|An immediate write-off of all inventory,Revenue for consideration expected to be retained|A refund liability|An asset for the right to recover returned products,,strict,"Recognise **revenue only for the amount expected to be retained**, together with a **refund liability** and an **asset for the right to recover returned products**.",core,TRUE,,,,,,,,,,,,,,,,,,,,,,,,,,,,,,
3f8bc992-1b87-1da6-f1df-1cb76fec8a57,IFRS 15,Revenue,Sale with a right of return,Recognition,dropdown,Revenue for goods subject to a right of return is recognised only to the extent it is highly probable that a significant ____ will not occur.,impairment|reversal|cash outflow|financing loss,reversal,,strict,The variable consideration constraint requires it to be **highly probable that a significant reversal of cumulative revenue will not occur**.,core,TRUE,,,,,,,,,,,,,,,,,,,,,,,,,,,,,,
fd144b69-512e-e0ec-2324-1356e108dc2f,IFRS 15,Revenue,Sale with a right of return,Application,mcq,A new product is sold with a 90-day return right. The entity has no historical or market evidence from which to estimate returns. What is the appropriate revenue treatment at the sale date?,Recognise all revenue because control transferred|Recognise half of the revenue|Do not recognise revenue until the return right lapses|Recognise revenue and a provision based on management's preferred estimate,Do not recognise revenue until the return right lapses,,strict,"Without reliable evidence, the entity cannot conclude that a significant reversal is highly improbable. It therefore **does not recognise revenue until the return right lapses**, assuming the goods are not returned.",applied,TRUE,,,,,,,,,,,,,,,,,,,,,,,,,,,,,,
f1f95e89-5659-6edc-20b2-c06b7de5a1d6,IFRS 15,Revenue,Sale with a right of return,Presentation,multi_part,"A product costing 8,000 is transferred, but no revenue can yet be recognised because the return outcome is too uncertain. Complete the inventory-related entry.",,,,variants,The inventory is reclassified to an **asset for the right to recover the product**. No cost of sales is recognised while the sale remains unrecognised.,applied,TRUE,Debit,text,,"Asset for right to recover product 8,000",Asset for right to recover returned product 8000|Right of recovery asset 8000,Credit,text,,"Inventory 8,000",Inventory 8000,,,,,,,,,,,,,,,,,,,,
ab42ea87-a386-4e7f-a98a-42737b22a0ed,IFRS 15,Revenue,Sale with a right of return,Presentation,multi_part,"A return right lapses and the customer keeps the product. The cash selling price is 10,000 and cost is 8,000. State the balances recognised at that date.",,,,variants,"Once the return right lapses, recognise **receivable and revenue of 10,000**, and transfer the **8,000 recovery asset to cost of sales**.",applied,TRUE,Revenue entry,text,,"Debit receivable 10,000 and credit revenue 10,000",DR receivable 10000 CR revenue 10000|Receivable and revenue 10000,Cost entry,text,,"Debit cost of sales 8,000 and credit asset for right to recover product 8,000",DR cost of sales 8000 CR recovery asset 8000|Cost of sales and recovery asset 8000,,,,,,,,,,,,,,,,,,,,
